author,message,datetime
human,"Let's play a quiz game. I'll ask you a question, and you respond with your best answer. Sounds good?",2_24_2023 3_52_33 PM
chatgpt,Sure! I'm ready to play.,2_24_2023 3_52_33 PM
human,"If I am outdoors and I feel something wet hit me, what might it be?",2_24_2023 3_52_33 PM
chatgpt,"If you are outdoors and you feel something wet hit you, it might be rain, snow, sleet, hail, or even a bird dropping.",2_24_2023 3_52_33 PM
human,"If I am inside and I feel something wet hit me, what might it be?",2_24_2023 3_52_33 PM
chatgpt,"If you are inside and you feel something wet hit you, it might be water from a leaky roof, a spilled drink, or condensation from an air conditioning unit or a cold surface.",2_24_2023 3_52_33 PM
human,"If someone throws me a ball from a rooftop, I reach up to catch it and it falls through my fingers, where would the ball hit me?",2_24_2023 3_52_33 PM
chatgpt,"If someone throws you a ball from a rooftop, and you reach up to catch it but it falls through your fingers, the ball would likely hit you on your head. It's important to be careful when attempting to catch objects thrown from a high place, as they can cause injury if not caught properly.",2_24_2023 3_52_33 PM
human,"If I am driving and I see someone crossing the street in front of me, what should I do?",2_24_2023 3_52_33 PM
chatgpt,"If you are driving and you see someone crossing the street in front of you, you should slow down or stop to let them cross safely. It's important to always be aware of pedestrians and give them the right of way, as they are more vulnerable than drivers and have less protection in case of an accident. Additionally, be sure to obey traffic laws and signals and stay alert for any unexpected movement from pedestrians or other vehicles on the road.",2_24_2023 3_52_33 PM
human,"As I go to press the brakes, they break and I am unable to slow the car down. What should I do?",2_24_2023 3_52_33 PM
chatgpt,"If you go to press the brakes and they fail, and you are unable to slow the car down, here are some steps you can take to try to bring the car to a stop:Stay calm and try not to panic. Panicking can impair your ability to make good decisions in a crisis.Downshift to a lower gear if you have a manual transmission or move the gear selector to a lower gear if you have an automatic transmission. This will help slow the car down.Use the parking brake to slow the car down. Pull the parking brake slowly and steadily to avoid locking up the wheels.Look for an escape route. Scan the road ahead for any open spaces or obstacles you can use to bring the car to a stop, such as an empty field, a gravel shoulder, or a pile of soft dirt.Alert other drivers by honking the horn or flashing your headlights.Call 911 and let the emergency operator know about the situation.Remember, failing brakes is a very dangerous situation, and it's important to act quickly and decisively to prevent an accident or injury.",2_24_2023 3_52_33 PM
human,"After the brakes fail, I downshift, scan the road, and see only one escape route through a group of farm animals. What should I do?",2_24_2023 3_52_33 PM
chatgpt,"If you downshift and scan the road after the brakes fail and see only one escape route through a group of farm animals, it's important to take immediate action to prevent an accident or injury.Here are some steps you can take:Sound your horn to alert the animals and try to scare them away from the road.Slow down as much as possible before entering the group of animals.Aim for the gaps between the animals, and steer the car as smoothly as possible to avoid hitting them.If you do hit an animal, try to stay in control of the car and bring it to a stop as soon as possible. Be sure to alert other drivers and call 911 to report the accident.Remember, it's important to stay alert and focused on the road at all times, especially in emergency situations like this. Always prioritize your safety and the safety of others on the road.",2_24_2023 3_52_33 PM
human,Let's change the quiz questions. Are you ready to restart?,2_24_2023 3_52_33 PM
chatgpt,"Sure, I'm ready to restart. Go ahead and ask me a new question.",2_24_2023 3_52_33 PM
human,"If I face my chest towards the sunrise and raise my arm to the right, what direction would I be pointing?",2_24_2023 3_52_33 PM
chatgpt,"If you face your chest towards the sunrise and raise your arm to the right, you would be pointing to the south.",2_24_2023 3_52_33 PM
human,"If I fall asleep at dusk and wake up at dusk, how long would I have slept?",2_24_2023 3_52_33 PM
chatgpt,"If you fall asleep at dusk and wake up at dusk, you would have slept for approximately 12 hours. Dusk is the time when the sun is below the horizon, and it occurs approximately 12 hours after sunrise. However, the exact time of dusk can vary depending on your location and the time of year.",2_24_2023 3_52_33 PM
human,"If I sleep for a week and stay awake for a week starting on January 1st, what month will it be once I've been awake for 30 days in the year?",2_24_2023 3_52_33 PM
chatgpt,"If you sleep for a week and stay awake for a week starting on January 1st, you would have completed two cycles of sleeping for a week and being awake for a week by the time 30 days have passed in the year.Assuming each month has an average of 30 or 31 days, you would be in the month of March by the time you've been awake for 30 days in the year. Specifically, if you sleep for the first week of January and then stay awake for the next week, you would complete your first cycle by January 14th. You would then complete your second cycle by January 28th, which would mean you have been awake for 14 days in January. Adding 30 more days to that would bring you to February 27th, which means you would be in the month of March by the time you've been awake for 30 days in the year.",2_24_2023 3_52_33 PM
human,I am in a room with 100 boxes. Each box contains a random number between 1 and 100. There are no duplicate numbers. What are the chances that I pick a number that matches the day I was born?,2_24_2023 3_52_33 PM
chatgpt,"Assuming that each box contains a random number between 1 and 100, with no duplicate numbers, and that your birthdate is represented in this range, the probability that you pick a box containing the number that matches the day you were born is 1 in 100, or 1%.This is because there are 100 boxes, each containing a different number, and only one of those numbers matches the day you were born. Therefore, the probability of picking the box with the matching number is 1 out of 100.",2_24_2023 3_52_33 PM
human,"I am in a room with 100 boxes. Each box contains a random number between 1 and 100. There are no duplicate numbers. What are the odds that I pick two numbers that, when multiplied together, are equal to the year I was born?",2_24_2023 3_52_33 PM
chatgpt,"The year you were born is a single specific number, and it is not clear from the problem statement which year that is. However, assuming the year you were born is represented in the range of possible products of two numbers between 1 and 100, the odds of randomly selecting two numbers from the 100 boxes whose product equals the year you were born is relatively low.The total number of possible products that can be formed by multiplying two numbers between 1 and 100 is 100 times 100, or 10,000. However, the vast majority of these products will not correspond to the year you were born. For example, if you were born in the year 2000, then the only possible pairs of numbers whose product equals the year you were born are 20 and 100 or 25 and 80. This means that the probability of selecting two boxes containing those two specific numbers is 2 out of 10,000, or 0.02%.So, in general, the odds of randomly selecting two numbers from the 100 boxes whose product equals the year you were born are very low, unless your birth year is a perfect square, in which case there are two such pairs of numbers.",2_24_2023 3_52_33 PM
human,"What two integers, when multiplied together, equal 1999?",2_24_2023 3_52_33 PM
chatgpt,"To find two integers that multiply to 1999, we can start by finding the prime factorization of 1999.We can start by dividing 1999 by 2, but since 1999 is an odd number, we know that it is not divisible by 2. We can continue by checking if it is divisible by any odd numbers less than or equal to the square root of 1999.We find that 1999 is not divisible by 3, 5, 7, 11, 13, 17, 19, 23, 29, 31, or 37. This means that 1999 is a prime number, and the only way to multiply two integers to get 1999 is to use 1 and 1999, which are both factors of 1999. Therefore, the two integers that multiply to 1999 are 1 and 1999.",2_24_2023 3_52_33 PM
human,"I have three cups in front of me. Two of them contain poison, one of them contains water. The cups are labeled left, right, and center. Which do you choose?",2_24_2023 3_52_33 PM
chatgpt,"Assuming that the cups are arranged randomly and the labeling is accurate, the best option is to choose any cup other than the center cup.If you choose the center cup, the probability of picking a cup with poison is 2 in 3, or approximately 67%. However, if you choose one of the other two cups, the probability of picking a cup with poison is only 1 in 2, or 50%.So to maximize your chances of avoiding the poison, you should choose either the left or the right cup, which gives you a 50% chance of picking the water and a 50% chance of picking the poison.",2_24_2023 3_52_33 PM
